Input,Output,ImageName
how much money did the average consumer plan to spend on valentine's day gifts for co-workers in 2014?,53.68,two_col_41292.png
how many minutes of tv did women consume daily?,196,multi_col_20106.png
how many minutes of tv did men consume in the uk in 2019?,170,multi_col_20106.png
what was the average consumer spend on mobile apps per smartphone as of the first quarter of 2020?,5.29,two_col_81540.png
what was indonesia's total consumer spending in 2008?,311.77,two_col_80661.png
what was the average expenditure on refrigerators and freezers per consumer unit in the united states in 2019?,76.06,two_col_43044.png
what was the average expenditure on window air conditioners per consumer unit in the united states in 2019?,4.13,two_col_82242.png
what was the total gross gaming revenue of u.s. casinos in 2020?,29981.68,two_col_2185.png
what percentage of respondents said they had increased the frequency of shopping trips for immediate consumption?,19,multi_col_101117.png
"by 2026, the total receipts of the u.s. government are expected to increase to what?",5.33,two_col_40421.png
how much did the total consumption expenditure on clothing of italian households fluctuate between 2008 and 2018?,51053,two_col_20783.png
"what was the total consumer expenditure in tesco's stores for the 12-week period ending march 26th, 2017?",7145,multi_col_994.png
how much did the average annual expenditures for transportation increase in 2019 compared to 2018?,10.1,multi_col_100605.png
what percentage of total coffee and tea consumption in canada in 2012 was coffee consumption?,57.7,two_col_43812.png
what was the average annual expenditure on frozen meals per consumer unit in the united states in 2019?,67.48,two_col_22479.png
what is the projected decrease in the average end-use price of electricity by 2050?,9.6,two_col_4868.png
what was the total consumer spending on food in the uk in 2020?,103379,two_col_20305.png
what was the total consumption of industrial roundwood in the u.s. in 2018?,15792,two_col_62544.png
what was the average energy consumption per guest in africa in megajoules?,164,two_col_6255.png
how many items did consumers buy on average on black friday 2015?,4.08,two_col_24664.png
what was the total transaction value of p2p consumer lending in 2018?,2889.4,multi_col_40819.png
in what year did the average premium per capita increase by 319 euros?,2017,two_col_62629.png
what was the average expenditure on refrigerators and freezers per consumer unit in the united states in 2019?,7.86,two_col_82458.png
what was the total consumer spending in the uk in 2020?,116361,two_col_23467.png
is the sum of two lowest value of green graph greater than higest value of orange graph?,Yes,10468.png
in which time period the difference between blue and orange graph minimum?,Jan 2018,4612.png
what is the sum of lowest green graph value and highest orange graph value?,98,6381.png
what's the sum of first point and largest value of orange graph?,20.7,8376.png
what is the difference in % saying that there is solid evidence of warming among democrats and republicans in 2012?,37,15477.png
what is the sum of the largest difference and the smallest difference in opinions between the two candidates?,18,15829.png
is the least difference between blue and orange graph greater than least value of blue graph?,No,18163.png
add up all the three least value and then find the difference between mostly politics and controversies and the sum total?,12,13774.png
what is the difference in value between completely agree and sum of dk and mostly agree in pie chart?,2,15472.png
what is average total meat supply per person in ghana?,10.5,01606743005377.png
does the sum of value of china and finland is greater then the difference of sri lanka and finland?,Yes,23940851006052.png
what the sum value of mauritius and dominica?,83,24497347006184.png
find ratio of the sum and difference of the two percentage values (ignore decimal values)?,1.31,26334874005187.png
is the average value of two smallest bars more than 0.60 years?,Yes,30699546002290.png
find the sum and the difference of the adequacy of social insurance programs percentage in the brazil and pakistan separately?,"[66.98, 28.1]",77793907011056.png
is the sum of not at all and not much in conservative republicans more than the sum value of not at all and not much liberal democrats ?,Yes,1493.png
what's the sum of the median of all the bars and the average of the two smallest bar?,87,2191.png
"what's the difference between averages of all the bars in 18-29 and the largest bar in the ""all adults"" category?",8,2336.png
what is the difference between major reasons and minor reasons seen as fun??,0.16,5953.png
what is the total sum of college+ for unfavorable and favorable,100,7598.png
what was the difference between the total of all the groups� responses?,0.29,9580.png
is the average of all the total bars equals to the average of all the democrat bars?,Yes,9599.png
what is the total sum of fdi stocks in canada and ireland?,120.6,OECD_FDI_STOCKS_CAN_CHE_ISL_USA_000006.png
which leader got the maximum difference between confidence and no confidence?,Abe,10129.png
what is the difference between the maximum and minimum anxiety disorders rate over the different age groups?,414.14,87563418009479.png
is the difference of orange and grey bar more then 2?,Yes,87897560003131.png
what is the difference between the average age of the russian population between the years 1990 and 2019?,5.1,two_col_60813.png
what is the total percentage of decreased and increased?,30,two_col_83449.png
does the number of marriages increase or decrease?,decreasing,two_col_100326.png
in which year the average number of employees working in h&m were minimum?,2005,two_col_1271.png
what is the difference between the maximum average number of employees working in h&m in an year and the minimum average number of employees working in an year?,91762,two_col_1271.png
what is the sum total of canada and others countries targeted rate by bec scams,24.5,two_col_4782.png
what is the percentage difference between minimum and maximum time for which the people waited at the airport?,40,two_col_20850.png
"is the average net sales share of jewelry collections, engagement jewelry and designer jewelry less than 30?",No,two_col_22701.png
what is the percentage difference between maximum and minimum frequency usage of internet in us?,55,two_col_23267.png
what is the difference between the maximum sales share and the average sales share?,9.8,two_col_24555.png
what is the sum of the lowest  amount wagered on counter-strike and its average across all years?,5.95,two_col_40260.png
does the traffic increase/decrease?,decreasing,two_col_60285.png
"in which age group, the difference between the votes received by hillary clinton and donald trump was maximum?",18 to 24 years,multi_col_204.png
what is the difference between highest increase and decrease percentage ?,3,multi_col_100568.png
what year showed an increase in total average birth weight even though the average boy birth weight decreased,2017,multi_col_101111.png
what's the total average for agriculture and industry for econmoic sector in 2020,65.69,multi_col_1304.png
what is the difference between maximum share of micron and minimum share of sony over the years?,34.8,multi_col_844.png
in which age group the difference between the number of male and female visitors is minimum?,16-24,multi_col_849.png
what is the difference between maximum gdp in agriculture sector and minimum gdp in industry over the years?,21.91,multi_col_960.png
what the sum total breakdown in the year 2019 in manufacturing and services ?,580.26,multi_col_1501.png
what is the average between 15-64 years population and the difference between 65 years and older and 0-14 years in 2019?,34.815,multi_col_20011.png
which year has the minimum difference between light blue bar and dark blue bar?,White,multi_col_20093.png
what is the difference between the maximum percentage share and the minimum percentage share in 10-14 years?,17,multi_col_20251.png
what is the difference between the maximum and minimum threshold for herd immunity for smallpox as of 2013?,2,multi_col_20268.png
what is the difference between the maximum value of red bar and minimum value of blue bar?,27,multi_col_20392.png
what is the difference between the maximum value of dietary supplements in 2015 and the minimum value of dietary supplements in 2020?,5.05,multi_col_20458.png
what is the average of total market?,267,multi_col_20618.png
which product has the minimum difference between the amount of skin products used by male and female?,At-home skin device,multi_col_20891.png
what is the difference between the domestic and total market in 2019?,5,multi_col_20962.png
in which age group the difference between trim and do nothing is maximum?,65+,multi_col_21134.png
what is the difference between maximum and minimum consumption of beef?,4.6,multi_col_40047.png
in which year the difference between revenues of retail and wholesale is maximum?,2019,multi_col_60166.png
what is the difference between sum of all investments and development?,0.65,multi_col_60227.png
what is the sum (total male and female) of air force?,63902,multi_col_60850.png
which year has the maximum difference between the age categories?,2017/18,multi_col_60956.png
what is the sum total of all the country in the year 2015?,52.9,multi_col_80291.png
in which year the increase of the blue line value compared to the previous year was maximum?,2020,multi_col_83.png
